{
  "schema": "reaction-cards",
  "version": 1,
  "as_of": "2026-10",
  "source": "skills/ui-evaluator/references/methods/surveys-metrics.md §3.10 (EMP-07; CRAFT-063).",
  "note": "Starter list assembled for UI-Evaluator from generic usability qualities, written as opposite pairs, plus one word for each of Aaker's five brand-personality dimensions. It is not taken from any published card set and is a starting point, not a validated instrument. Add the brand's own words (each X attribute an on-brand candidate, each Y an off-brand word), swap starter words so the total stays near 25 and the negative share near 40%, then pre-register on-brand and off-brand words in analysis-plan.md before any session. Set `brand_tag` to \"on-brand\" or \"off-brand\" in the project copy (studies/<id>/instruments/) when pre-registering; null means untagged.",
  "target": {
    "size": 25,
    "negative_share": 0.4
  },
  "procedure": [
    "Pre-register the on-brand and off-brand words before any session.",
    "Randomise word order per participant and record the seed.",
    "Ask participants to mark every word that fits, choose the five that fit best, and say why for each.",
    "Analyse with `uie study desirability`: k participants with at least one on-brand word in their top five, out of n."
  ],
  "words": [
    {
      "word": "clear",
      "polarity": "positive",
      "brand_tag": null
    },
    {
      "word": "effortless",
      "polarity": "positive",
      "brand_tag": null
    },
    {
      "word": "quick",
      "polarity": "positive",
      "brand_tag": null
    },
    {
      "word": "trustworthy",
      "polarity": "positive",
      "brand_tag": null
    },
    {
      "word": "friendly",
      "polarity": "positive",
      "brand_tag": null
    },
    {
      "word": "organised",
      "polarity": "positive",
      "brand_tag": null
    },
    {
      "word": "fresh",
      "polarity": "positive",
      "brand_tag": null
    },
    {
      "word": "flexible",
      "polarity": "positive",
      "brand_tag": null
    },
    {
      "word": "calm",
      "polarity": "positive",
      "brand_tag": null
    },
    {
      "word": "polished",
      "polarity": "positive",
      "brand_tag": null
    },
    {
      "word": "honest",
      "polarity": "positive",
      "brand_tag": null
    },
    {
      "word": "lively",
      "polarity": "positive",
      "brand_tag": null
    },
    {
      "word": "capable",
      "polarity": "positive",
      "brand_tag": null
    },
    {
      "word": "refined",
      "polarity": "positive",
      "brand_tag": null
    },
    {
      "word": "sturdy",
      "polarity": "positive",
      "brand_tag": null
    },
    {
      "word": "confusing",
      "polarity": "negative",
      "brand_tag": null
    },
    {
      "word": "tiring",
      "polarity": "negative",
      "brand_tag": null
    },
    {
      "word": "slow",
      "polarity": "negative",
      "brand_tag": null
    },
    {
      "word": "unreliable",
      "polarity": "negative",
      "brand_tag": null
    },
    {
      "word": "cold",
      "polarity": "negative",
      "brand_tag": null
    },
    {
      "word": "cluttered",
      "polarity": "negative",
      "brand_tag": null
    },
    {
      "word": "dated",
      "polarity": "negative",
      "brand_tag": null
    },
    {
      "word": "rigid",
      "polarity": "negative",
      "brand_tag": null
    },
    {
      "word": "stressful",
      "polarity": "negative",
      "brand_tag": null
    },
    {
      "word": "unfinished",
      "polarity": "negative",
      "brand_tag": null
    }
  ]
}
